{
  "analysis_inclusion": {
    "artifact_quality": true,
    "process_dynamics": true,
    "terminal_success": true
  },
  "artifact_layout_version": "0.1.0",
  "created_at": "2026-05-06T00:39:37.019638Z",
  "final_success": false,
  "metrics": {},
  "run_id": "blind-maze-explorer-algorithm__scout",
  "run_protocol_version": "0.1.0",
  "run_status": "completed_failure",
  "termination_reason": "verifier_fail"
}
